{"contract":"ConvergeCompositionReceipt/v1","dispatch_authorized":false,"schema_version":1,"seamwise":{"lineage":{"path":"seamwise/task-plan-lineage.json","sha256":"67145c780aa2659b46a0e3519c27ac90aea6d8874196433adcf39b4b821fe23f"},"review":{"path":"seamwise/reviews/delivery-plan-review.json","plan_sha256":"9e381aa84cee5e90d38ba449976649a596edd74c0f64fd81726f183c93589496","reviewer":"Bruno Nunes","sha256":"b1cb0cd84cb5f9556edddfbabfad9e0bb49b8a561310a2ced91806bc1cc63465"},"task_plan":{"digest":"801d6d469761ea4dcdd62c0095b030e8ca4e7a0627970ab11f8a7a692dd364fe","path":"seamwise/task-plan.json"}},"source":{"commit":"4b84f004cefd566d2038ba52339a3b9e72530fbe","path":"cvg/swimlanes/guarda-nome-recipe.yaml","sha256":"4861ccf599935f34d393d0cf4159f77df931d6fcdb86c0897320e099adbd8bd6"},"task_spec":{"materialization_receipt":{"path":"cvg/receipts/composition/taskspec-materialization-receipt.json","sha256":"33b55454fcb4e2103e5c45776fcde617927ca3c27bc91934f258d4f9cdffba3b"}},"tasks":[{"path":"cvg/tasks/T-20260925-guarda-registra-nome-oficial.md","sha256":"5200fda78122583aaab9d21d6898bddf5920f575d664f7b9b2e64634bf98b03b","task_id":"T-20260925-guarda-registra-nome-oficial"}],"versions":{"converge":"0.2.0","seamwise":"0.2.0","task_spec":"3.8.1"}}
