{"contract":"ConvergeCompositionReceipt/v1","dispatch_authorized":false,"schema_version":1,"seamwise":{"lineage":{"path":"seamwise/task-plan-lineage.json","sha256":"998277660a7baeba4c6b69da427e565a0c384cef421d06a4e28af21b982a808b"},"review":{"path":"seamwise/reviews/delivery-plan-review.json","plan_sha256":"3f0937b8692416d54b76c1e8aa1b45a0732cd4220679332497c8f9244d89f4e1","reviewer":"release-owner","sha256":"450db04c2d80d553e5b1b65938aa0f64db29d7dbfc283c171e7098fa1239ee27"},"task_plan":{"digest":"5de965b73344a1d57abcbe2a1025e7a0ace5cb513e1975e7d740761265a72a09","path":"seamwise/task-plan.json"}},"source":{"commit":"fc8b4cfcd8e2acb8f107663d272f0218c1a51967","path":"recipe.yaml","sha256":"a078d25d0f8726379a4d994c559da1a741c8072dedf727576604f0db4a8987c3"},"task_spec":{"materialization_receipt":{"path":"cvg/receipts/composition/taskspec-materialization-receipt.json","sha256":"b3c5575d7aa71f6fbafdc4a298180956534bfb835e84aa0ea32c15c5566f37e7"}},"tasks":[{"path":"cvg/tasks/T-20260815-health-status.md","sha256":"b66f35bf77bedc91cc6bf702637dc560e6960d029bb7ca10f441f273d5ab28b0","task_id":"T-20260815-health-status"}],"versions":{"converge":"0.2.0","seamwise":"0.2.0","task_spec":"3.8.0"}}
