{"contract":"ConvergeCompositionReceipt/v1","dispatch_authorized":false,"schema_version":1,"seamwise":{"lineage":{"path":"seamwise/task-plan-lineage.json","sha256":"4098e17d9282594b63a1f077ab3f176450ea8413ed47b2cb23bf6c959fac3315"},"review":{"path":"seamwise/reviews/delivery-plan-review.json","plan_sha256":"e1684b55ec0750c1e54969fb858762e96b7c4e1faf720f7b482439ce6a5c997a","reviewer":"Bruno Nunes","sha256":"5ec9b75aeedc82372e8fdb62ed24056fd783eed4195edbc4d2ea2a51645aca9f"},"task_plan":{"digest":"c06d5c3d93408102b0704c7bfd42860d90a559291f4ce412ae377fe55cc10847","path":"seamwise/task-plan.json"}},"source":{"commit":"5baed60544b3bfbd591afec5bb21dfa27da15aab","path":"cvg/swimlanes/pda-recipe.yaml","sha256":"d20d78520e9ed6211e941b019412d4071a7a51c5f28175315c02796cbdd2b208"},"task_spec":{"materialization_receipt":{"path":"cvg/receipts/composition/taskspec-materialization-receipt.json","sha256":"5fe3dde5f286df2c3f6810196b883dd179a7068d2a58298003faae81bc2dff1b"}},"tasks":[{"path":"cvg/tasks/T-20260921-agregacao-exata.md","sha256":"82c42946f10781f2a7f4e9454face51667498a092faf81c8e4bbc743f037422b","task_id":"T-20260921-agregacao-exata"},{"path":"cvg/tasks/T-20260921-contrato-ancora.md","sha256":"35228965ac26e885ff4de3e7704e7a1b87ad75d030349b02728dae755703d7a1","task_id":"T-20260921-contrato-ancora"},{"path":"cvg/tasks/T-20260921-envelope-fronteira.md","sha256":"a3112c004816d6caff1fca87760b2d61f9f8bf10370703efe60d2c1c4acc242a","task_id":"T-20260921-envelope-fronteira"},{"path":"cvg/tasks/T-20260921-evidencia-packet.md","sha256":"2b97b803c7c271714606d00d9e80719c9ed9e1b59f2a2db444d36a1690056f86","task_id":"T-20260921-evidencia-packet"},{"path":"cvg/tasks/T-20260921-juizo-classifica.md","sha256":"1e248b422288edd680c9a08161ee7100aff2919d8f52790ed74b59407cdd6a54","task_id":"T-20260921-juizo-classifica"},{"path":"cvg/tasks/T-20260921-leitura-posicional.md","sha256":"600b6df6aec793d29fa01e4ee173a7147ef5e03913eca6b7e02124b5d8fd4fb3","task_id":"T-20260921-leitura-posicional"},{"path":"cvg/tasks/T-20260921-orquestra-desfecho.md","sha256":"a6ebe214a16ae99f66f3923b0fe97d88e9de75294813f22ad07068ceea69caf3","task_id":"T-20260921-orquestra-desfecho"}],"versions":{"converge":"0.2.0","seamwise":"0.2.0","task_spec":"3.8.1"}}
