{"contract":"ConvergeCompositionReceipt/v1","dispatch_authorized":false,"schema_version":1,"seamwise":{"lineage":{"path":"seamwise/task-plan-lineage.json","sha256":"8d6563ba1c77a512821ef29ae24a1bbb6b1fecc967a878cb0473929da14f4776"},"review":{"path":"seamwise/reviews/delivery-plan-review.json","plan_sha256":"92cc159999c8be4e56f6dfcd8d13c11d0e2223c86a8aac4720abd9842c3df038","reviewer":"Bruno Nunes","sha256":"b182152e250ae379d3038d7c6fecb99824cdc3b69f39d4470d01993fcd4af583"},"task_plan":{"digest":"c84f7c5a1e486c137b342c654fc98f5551fc93566edae5feba72a7d76c4abc96","path":"seamwise/task-plan.json"}},"source":{"commit":"86979a88321b571f2b2e50d372c679a39b3bc7df","path":"cvg/swimlanes/medalhao-v4-recipe.yaml","sha256":"1a813dc4f8be76bacf6a26378b7054e178c84b7c1d72548c3a40d3e271b657ca"},"task_spec":{"materialization_receipt":{"path":"cvg/receipts/composition/taskspec-materialization-receipt.json","sha256":"6a4940c8d2b8713f15c21a3516d206fc8514ea52f43c402251273980fcbea868"}},"tasks":[{"path":"cvg/tasks/T-20260923-contrato-expoe-grupos.md","sha256":"9690a2b171af37f9c330624027e1dfe40c0ae1834b5b71c86b85562d3d43d158","task_id":"T-20260923-contrato-expoe-grupos"},{"path":"cvg/tasks/T-20260923-gold-assuntos.md","sha256":"bf433fadfcf466e5c4f66d1119c8d270fcc9df27481ea074de95321919e18379","task_id":"T-20260923-gold-assuntos"},{"path":"cvg/tasks/T-20260923-gold-le-silver.md","sha256":"16704c758790cb9db97af4b6ac62bf7158e08c17a1c06f476c3e89c310f1a0cb","task_id":"T-20260923-gold-le-silver"},{"path":"cvg/tasks/T-20260923-ingestao-julgada.md","sha256":"c3a264127aa3818d054e18eacf9c00161e0839c82059aab48afbe64d525b8bd3","task_id":"T-20260923-ingestao-julgada"},{"path":"cvg/tasks/T-20260923-limpa-preparo.md","sha256":"313b0b3214f0754edbd485f73d36f73aeb673e477085a2163bc0344755b86ab4","task_id":"T-20260923-limpa-preparo"}],"versions":{"converge":"0.2.0","seamwise":"0.2.0","task_spec":"3.8.1"}}
